,Rehabilitasi Terminal Penumpang Pelabuhan Sanana,CV. RACHMAT PRATAMA,Kementerian Perhubungan,2024," Rp674,960,000.00 "," Rp843,770,000.00 "," Rp843,770,000.00 ",94943114,11 Mei 2024,Pekerjaan Konstruksi,APBN
,Rehabilitasi Rumah Dinas Type 36 ( 3 Unit ),CV. MUTIARA TIMUR CONTRACTOR,Kementerian Perhubungan,2024," Rp380,990,145.00 "," Rp409,910,000.00 "," Rp409,910,000.00 ",95144114,13 Mei 2024,Pekerjaan Konstruksi,APBN
,Pembangunan Ruang Rapat Pelayanan Satu Atap dan Tempat Pelayanan KSOP Bima,CV KARYA LESTARI,Kementerian Perhubungan,2024," Rp1,660,000,000.00 "," Rp2,075,700,000.00 "," Rp2,075,000,000.00 ",95163114,5 Juni 2024,Pekerjaan Konstruksi,APBN
,Pembangunan Terminal Penumpang,PT. VIONA KENCANA PERMAI,Kementerian Perhubungan,2024," Rp889,030,038,614.00 "," Rp24,000,000,000.00 "," Rp9,549,992,700.00 ",93578114,13 Februari 2024,Pekerjaan Konstruksi,APBN
,Revitalisasi UPPKB Sabilambo,PT. MERDEKA INTI PERSADA,Kementerian Perhubungan,2024," Rp1,653,815,681,681.00 "," Rp19,494,773,000.00 "," Rp19,483,168,276.02 ",93832114,31 Januari 2024,Pekerjaan Konstruksi,APBN
,Pembangunan Gedung Pelayanan BPTD Sulawesi Tenggara,CV. HASIL KARYA UTAMA,Kementerian Perhubungan,2024," Rp1,410,261,646,359.00 "," Rp14,450,042,000.00 "," Rp14,449,655,354.91 ",93887114,5 Februari 2024,Pekerjaan Konstruksi,APBN
,"Pengembangan Bandar Udara Long Apung, Malinau, Kalimantan Utara",PT. MERDEKA INTI PERSADA,Kementerian Perhubungan,2024," Rp17,641,000,000.00 "," Rp20,000,000,000.00 "," Rp18,999,999,000.00 ",93150114,24 Januari 2024,Pekerjaan Konstruksi,APBN
,Pembangunan Gedung Pelayanan BPTD NTT,CV. Wijaya Mandiri,Kementerian Perhubungan,2024," Rp1,451,992,956,392.00 "," Rp15,100,000,000.00 "," Rp14,571,000,000.00 ",93382114,13 Maret 2024,Pekerjaan Konstruksi,APBN
,Lanjutan Pelebaran Dermaga Pelabuhan Ampana dan Pengembangan Fasilitas Darat Pelabuhan Ampana,CV SINAR SARONDE LESTARI,Kementerian Perhubungan,2024," Rp99,153,394,732.00 "," Rp13,474,229,630.00 "," Rp13,434,623,000.00 ",94531114,27 Februari 2024,Pekerjaan Konstruksi,APBN
,LANJUTAN PENGEMBANGAN FASILITAS LAUT PELABUHAN MATUI,PT.TRI KARYA UTAMA CENDANA,Kementerian Perhubungan,2024," Rp5,303,730,431,734.00 "," Rp62,416,668,000.00 "," Rp62,416,666,494.82 ",93825114,19 Januari 2024,Pekerjaan Konstruksi,APBN
,PEKERJAAN KONSTRUKSI FLATFORM PERALATAN PERAWATAN DAN FASILITAS PENDUKUNG PERAWATAN SARANA PERKERETAAPIAN,PT. TOLERANSI ACEH,Kementerian Perhubungan,2024," Rp2,276,151,211,575.00 "," Rp26,030,974,000.00 "," Rp26,030,974,000.00 ",94791114,4/25/2024,Pekerjaan Konstruksi,APBN
,PENGEMBANGAN BANDAR UDARA LETUNG TAHAP II,ALAM LINTAS INDONESIA,Kementerian Perhubungan,2024," Rp2,347,341,588,836.00 "," Rp25,000,000,000.00 "," Rp24,199,390,000.00 ",92936114,15 Desember 2023,Pekerjaan Konstruksi,APBN
,Pembangunan Pelabuhan Penyeberangan Pulau Burung Tahap I,PT. Syarif Spesialis Karya,Kementerian Perhubungan,2024," Rp38,574,133,859.00 "," Rp45,381,280,000.00 "," Rp45,381,267,000.00 ",94079114,8 Maret 2024,Pekerjaan Konstruksi,APBN
,Pembangunan Terminal Barang Internasional Motamasin NTT Tahap III,CV. SARWO BATHI PERMANA,Kementerian Perhubungan,2024," Rp444,978,314,804.00 "," Rp4,889,857,875.00 "," Rp4,889,857,875.00 ",94375114,15 Maret 2024,Pekerjaan Konstruksi,APBN
,Peningkatan UPPKB NBS (Dampak Seroja),CV.ORLAND,Kementerian Perhubungan,2024," Rp3,065,800,000.00 "," Rp5,755,187,000.00 "," Rp3,419,965,000.00 ",93384114,16 Januari 2024,Pekerjaan Konstruksi,APBN
,Pembangunan Terminal Barang Internasional Wini NTT Tahap III,PT. HISAR MAKMUR,Kementerian Perhubungan,2024," Rp171,871,610,965.00 "," Rp18,484,786,820.00 "," Rp18,484,778,000.00 ",94340114,18 Maret 2024,Pekerjaan Konstruksi,APBN
,"Peningkatan/ Revitalisasi Terminal Tipe A Bimoku, Kupang NTT",CV. TIRA PERSADA,Kementerian Perhubungan,2024," Rp9,191,995,163.00 "," Rp10,391,000,000.00 "," Rp10,262,247,000.00 ",94399114,13 Maret 2024,Pekerjaan Konstruksi,APBN
,Peningkatan Jembatan Kereta Api BH 443 di Km.226+986 Antara Kemelak - Baturaja Lintas Prabumulih - Tarahan,PT KARYABARU ADYAPRATAMA,Kementerian Perhubungan,2024," Rp7,449,143,467,821.00 "," Rp83,034,370,000.00 "," Rp82,769,240,000.00 ",94697114,29 Maret 2024,Pekerjaan Konstruksi,APBN
,Peningkatan Jembatan Kereta Api BH 785 di Km. 344+599 antara Niru - Talang Padang Lintas Prabumulih - Muaraenim,PT. AGUNG KUSUMA,Kementerian Perhubungan,2024," Rp4,459,425,689,754.00 "," Rp50,491,440,000.00 "," Rp50,108,950,000.00 ",94700114,29 Maret 2024,Pekerjaan Konstruksi,APBN
,Penanganan Rintang Jalan Lintas Prabumulih - Tarahan Tahap II antara Gilas - Sepancar Km. 210+700 - Km. 214+200,PT. INSAN KHARISMA ABADI,Kementerian Perhubungan,2024," Rp23,325,500,000.00 "," Rp28,305,584,000.00 "," Rp28,087,989,000.00 ",94709114,29 Maret 2024,Pekerjaan Konstruksi,APBN
,Penanganan Rintang Jalan Lintas Prabumulih - Tarahan Tahap II antara Tulungbuyut - Negeriagung Km. 139+800 - Km. 144+700,PT. BIMA PANCA KARYA,Kementerian Perhubungan,2024," Rp2,253,488,080,176.00 "," Rp28,295,164,000.00 "," Rp28,168,601,000.00 ",95147114,29 Mei 2024,Pekerjaan Konstruksi,APBN
,Penanganan Rintang Jalan Lintas Prabumulih - Tarahan Tahap II antara Gilas - Sepancar Km. 206+100 - Km. 206+560,PT. Krida Utama,Kementerian Perhubungan,2024," Rp1,740,049,262,452.00 "," Rp21,819,909,000.00 "," Rp21,745,567,000.00 ",94707114,29 Maret 2024,Pekerjaan Konstruksi,APBN
,Penanganan Rintang Jalan Lintas Prabumulih - Tarahan Tahap II antara Gilas - Sepancar Km. 207+000 - Km. 210+500,PT. AGUNG KUSUMA,Kementerian Perhubungan,2024," Rp4,459,425,689,754.00 "," Rp50,491,440,000.00 "," Rp50,108,950,000.00 ",94700114,29 Maret 2024,Pekerjaan Konstruksi,APBN
,Peningkatan Jalur KA Lintas Tarahan - Tanjungenim Tahap I Segmen Stasiun Branti - Stasiun Tegineneng,PT. RINDANG SEJATI,Kementerian Perhubungan,2024," Rp19,352,016,000.00 "," Rp24,264,194,000.00 "," Rp24,190,020,000.00 ",95264114,4 Juni 2024,Pekerjaan Konstruksi,APBN
,Pembangunan Halte Sungai Desa Simalinyang,PT.PADMA BINTANG BUANA,Kementerian Perhubungan,2024," Rp1,810,663,018.00 "," Rp2,075,612,000.00 "," Rp2,073,612,000.00 ",95090114,5 Juli 2024,Pekerjaan Konstruksi,APBN
,Pembangunan Halte Sungai Desa Kuala Hidayat Desa Teluk Dalam,PT. DOMAS,Kementerian Perhubungan,2024," Rp1,920,000,000.00 "," Rp2,400,000,000.00 "," Rp2,400,000,000.00 ",95089114,1 Juli 2024,Pekerjaan Konstruksi,APBN
,Pembangunan Halte Sungai Kep. Mesah,CV. TIRA PERSADA,Kementerian Perhubungan,2024," Rp167,617,969,071.00 "," Rp1,933,437,000.00 "," Rp1,933,437,000.00 ",94830114,28 Juni 2024,Pekerjaan Konstruksi,APBN
,Peningkatan Geometrik Jalur KA Untuk Menunjang Pembangunan Jembatan KA BH 289 dan BH 309 Antara Blambanganumpu - Giham Lintas Prabumulih - Tarahan,PT. AMERTA GAMA NUSANTARA,Kementerian Perhubungan,2024," Rp776,546,400,387.00 "," Rp9,750,027,000.00 "," Rp9,706,830,000.00 ",94870114,4/23/2024,Pekerjaan Konstruksi,APBN
,Pembangunan Pelabuhan Penyeberangan Mantung Belinyu Prov. Bangka Belitung (Tahap I),PT. YUDHA PERKASA UTAMA,Kementerian Perhubungan,2024," Rp2,057,640,419,936.00 "," Rp43,439,570,894.00 "," Rp24,836,070,000.00 ",94966114,19 Juni 2024,Pekerjaan Konstruksi,APBN
